{
  "id": "belladone_foundation_secret",
  "universe_id": "palace_1930",
  "version": "0.6.0",
  "status": "specified",
  "public_legend": "Le Palace Belladone aurait été sauvé après la guerre par Alphonse de Valleroy, père d'Auguste, grâce à sa fortune et à sa seule vision.",
  "historical_truth": {
    "year": 1919,
    "partners": [
      {
        "id": "npc_alphonse_valleroy",
        "name": "Alphonse de Valleroy",
        "contribution": "Le nom, les relations bancaires et une partie du capital."
      },
      {
        "id": "npc_emile_mercier",
        "name": "Émile Mercier",
        "contribution": "Les terrains thermaux, des fonds, le soutien du personnel et le réseau local."
      }
    ],
    "agreement": "Un acte et une annexe prévoyaient une propriété partagée du palace, des droits durables pour la famille Mercier et une protection minimale du personnel.",
    "rupture": "Émile Mercier meurt dans une avalanche en 1920. Sa mort est accidentelle ; le jeu ne contient aucun second meurtre historique.",
    "fraud": "Alphonse profite du désordre successoral pour faire disparaître l'annexe, enregistrer le palace au seul nom des de Valleroy et effacer progressivement Émile de l'histoire officielle.",
    "consequence": "Le prestige du Belladone repose depuis quinze ans sur une appropriation frauduleuse et l'effacement d'une famille fondatrice."
  },
  "auguste_discovery": {
    "trigger": "Des écritures anciennes du grand livre et une photographie annotée conduisent Auguste à demander les archives notariales de Genève.",
    "confirmed_by": [
      "copie authentique de l'acte de 1919",
      "annexe de copropriété",
      "registre notarial et sceau authentique",
      "correspondance entre Alphonse de Valleroy et Émile Mercier"
    ],
    "planned_announcement": [
      "reconnaître publiquement le rôle d'Émile Mercier",
      "suspendre la vente du palace",
      "faire expertiser les droits de la famille Mercier",
      "placer une partie du palace dans une structure protégeant le personnel",
      "geler la succession de Camille jusqu'à clarification",
      "remettre à la police le faux codicille contemporain"
    ]
  },
  "narrative_function": {
    "primary_mystery": "Identifier le meurtrier d'Auguste.",
    "embedded_story": "Découvrir sur quel effacement historique le palace a été construit.",
    "complexity_limits": [
      "aucun second meurtrier à identifier",
      "aucune seconde chronologie criminelle à résoudre",
      "six documents historiques maximum",
      "le meurtre reste résoluble sans comprendre chaque détail juridique",
      "l'histoire cachée crée des mobiles et recontextualise les personnages sans remplacer la chaîne de preuves"
    ],
    "act_progression": {
      "act_1": "La légende officielle se fissure par une photographie, un nom effacé et une ancienne plaque.",
      "act_2": "Les versements Mercier, le partenariat et les irrégularités du registre apparaissent.",
      "act_3": "L'acte authentique établit l'appropriation frauduleuse et révèle le contenu réel de l'annonce d'Auguste."
    }
  },
  "immutable_rules": [
    "Émile Mercier n'a pas été assassiné.",
    "Auguste n'est pas l'auteur de la fraude de 1920.",
    "Auguste a décidé tardivement de réparer publiquement l'injustice.",
    "La vérité historique ne désigne pas à elle seule le meurtrier actuel.",
    "Camille reste le coupable canonique du meurtre d'Auguste."
  ]
}
